{
  "schemaVersion": 1,
  "decisionId": "DEC-2026-07-18-add-execution-profiles-select-execution-pro-4a7c",
  "commandRunId": "RUN-2026-07-18-chaos-propose-add-execution-profiles-9b1e2f",
  "selectedOptionId": "profile-compact",
  "selectedOptionIds": [],
  "freeformValue": null,
  "rationale": "Prompt-only change with a small blast radius. Compact keeps the full standard-risk gate set but consolidates sessions and reports and batches the independent decisions, which is the right assurance-to-ceremony ratio here.",
  "selectedBy": "vscode-user",
  "selectedAt": "2026-07-18T10:22:05+02:00",
  "source": "vscode-decision-center",
  "validatesAgainstDecisionHash": "sha256:3f9a2b7c1d4e6f8091a2b3c4d5e6f7089a1b2c3d4e5f60718293a4b5c6d7e8f9",
  "metadata": {
    "answerLatencySeconds": 395
  }
}
